infrastructure-subtype,relevance_to_human_wildlife_conflict,Entities,infrastructure_subtype,Category-Tags,gpt-relevance_to_conservation,Location,source_name,Flora_and_Fauna,publishedAt,author,relevance_to_illegal_wildlife_trade,language,description,gpt-relevance_to_infra,title,url,Landscape-Location,Keywords,source,indian_state,content,query
"Power lines, Canals, Pipelines, Railways",1.0,"['Odisha Government', 'Wildlife Trust of India (WTI)', 'Forest Department', 'East Coast Railway', 'Electricity Board', 'Irrigation Department', 'Gaj Utsav Odisha', 'Shri Pradip Kumar Amat', 'FE&CC', 'Dr. Manoj Nair', 'Dr. Sandeep Tiwari', 'B.B. Mehta', 'Odisha Power Transmission Corporation Ltd.', 'R.K. Rastogi', 'Tata Power Central Odisha Distribution Ltd.', 'IUCN AsESG', 'Asian Elephant Specialist Group']",,"Wildlife, Governance, Infrastructure",1.0,Bhubaneshwar,WTI,Asian Elephant (Elephas maximus),2024-04-15 00:00:00+00:00,WTI,0.0,English,"The Odisha Government & Wildlife Trust of India hosted a meeting in Bhubaneswar to discuss mitigating the negative impacts of linear infrastructure on elephants and wildlife, highlighting the alarming mortality rate of elephants due to infrastructure like railways and power lines.",0.9,Odisha Forest Dept. & WTI address the impacts of Linear infrastructure on elephants,https://www.wti.org.in/news/odisha-forest-dept-wti-address-the-impacts-of-linear-infrastructure-on-elephants/,,"Governance, Habitat Loss, Infrastructure, Marine Habitat, Terrestrial Habitat",,Odisha,"Bhubaneshwar, 12th April 2024:The Odisha Government & Wildlife Trust of India (WTI) hosted a consultative meeting in Bhubaneswar, bringing together stakeholders from the Forest Department, East Coast Railway, Electricity Board and Irrigation Department in Bhubaneshwar. The meeting aimed to discuss strategies to mitigate the negative effects of linear infrastructure on elephants and wildlife. This initiative builds uponGaj Utsav Odisha, a visionary campaign by the Wildlife Trust of India (WTI) which was launched by Shri Pradip Kumar Amat, Hon’ble Minister, FE&CC, Odisha, Govt. of India in October 2023. Odisha is home to over 1900 elephants spanning three elephant reserves and having 12 identified elephant corridors. While these majestic animals roam freely across the country’s vast landscapes, they face challenges in their right to move across their natural habitats. Launched in 2018, the Gaj Utsav campaign seeks to raise awareness about safeguarding the future of India’s National Heritage Animal, while also advocating for their essential Right of Passage across elephant range states in India. The discussion brought together stakeholders from the Forest Department, East Coast Railway, Electricity Board and Irrigation Department | Photo by Upasana Ganguly The meeting was presided over by Dr. Manoj Nair, IFS, CCF (WL), Odisha Forest Department, and attended by 20 representatives from the Forest Department, East Coast Railways, Electricity Board, the Irrigation Department and Wildlife Trust of India (WTI). The discussions primarily focussed on strengthening the policy guidelines for avoiding, reducing and mitigating the adverse impacts of linear infrastructure such as power lines, canals, pipelines, and railways on wildlife. One of the major concerns of linear intrusions is the alarming mortality rate of elephants, with approximately 45-50 elephants dying due to electrocution annually in India, and over 367 elephants falling victim due to train accidents since 1987 alone. Deliberations on finding solutions to mitigate elephant deaths from electrocution were central to the discussion. Dr. Manoj V. Nair, IFS, APCCF Wildlife, Odisha Forest Department addressed the group | Photo by Upasana Ganguly The meeting also highlighted the ongoing conservation initiatives undertaken by the Odisha Forest Department and WTI’s interventions at safeguarding elephant populations. Additionally, brainstorming sessions were conducted to explore innovative approaches to restore connectivity for wildlife across linear intrusions. A Handbook on ‘Mitigate the Impacts of Roads and Railways on Asian Elephants’ by IUCN AsESG’s (Asian Elephant Specialist Group) Asian elephant transport working group was officially released by Dr. Manoj Nair, IFS, CCF (WL), Dr. Sandeep Tiwari, Chief of Conservation, WTI, Mr B.B. Mehta, Director, Odisha Power Transmission Corporation Ltd. and Mr R.K. Rastogi, Chief Operations, Tata Power Central Odisha Distribution Ltd. . Release of the handbooks brought out by IUCN AsESG’s Asian elephant transport working group | Photo by Upasana Ganguly Dr. Manoj V. Nair, IFS, CCF (WL), of the Odisha Forest Department, expressed gratitude on behalf of the State Wildlife Wing to WTI for organising the brainstorming session. He expressed hope for more such sessions during the yearlong Gaj Utsav and believed that the deliberations would assist in framing more informed policies and strategies for mitigating impacts of linear infrastructure in the State. Dr. Sandeep Tiwari, Chief of Conservation and co-author of the handbook at WTI, remarked that the workshop with linear infrastructure (LI) agencies and the forest department served as a valuable platform for sharing best practices and planning mitigation strategies. He mentioned that the handbook would offer much-needed guidelines and design to LI agencies in Odisha, aiding them in undertaking mitigation efforts and facilitating unhindered animal movement. The collaborative efforts of stakeholders from various sectors underscored the commitment to protecting India’s elephants and fostering insightful discussions on challenges, conservation strategies, and sustainable development models for elephant protection.",India Conservation
Energy,0.0,"['India', 'Bihar', 'Ethanol Blended Petrol Programme', 'Department of Agriculture', 'InvestAid India', 'Department of Industries', 'Patel Agro Industries Pvt. Ltd.', 'CSTEP', ""Internews' Earth Journalism Network"", 'Pranav Kumar']",,"Governance, Climate and Energy, Infrastructure",0.6,Bihar,Mongabay,,2024-04-12 00:00:00+00:00,Pranav Kumar,0.0,English,"Bihar aims to increase its grain-based ethanol production to reduce fossil-fuel dependency, with the central government approving 47 ethanol plants in the state. This move towards ethanol blended fuel aims to lower environmental impacts and greenhouse gas emissions. The price of maize, a key ingredient for ethanol, has risen, benefiting farmers and ethanol manufacturers.",0.8,[Video] Maize takes centre stage as Bihar ramps up biofuel production,https://india.mongabay.com/2024/04/video-maize-takes-centre-stage-as-bihar-ramps-up-biofuel-production/,,"Agriculture, Governance, Climate Change",,Bihar,"Bihar aims to increase its maize-based ethanol production after the central government approved 47 ethanol plants in the state, of which at least 32 are grain-based.With the increase in demand for ethanol, to reduce fossil-fuel dependency, the price of maize has increased in the state.Farmers and ethanol manufacturers in Bihar report that the price rise and subsidies from the government to enable ease-of-business, have been beneficial. Years after Bihar banned alcohol, its active ingredient, ethanol, is finding a fresh use. The central government has approved47 ethanol plants in the state, of which at least 32 are grain-based. Ethanol can be extracted from plants such as sugarcane or maize after they are fermented and processed. The ethanol thus derived is mixed with petrol or diesel to make blended fuels for vehicles. This blended fuel is considered to have a lower environmental impact. Also, more domestic biofuel would mean fewer fossil fuel imports and greenhouse gas emissions. In 2018, India had set a target of blending 20% ethanol in petrol by 2030, under theEthanol Blended PetrolProgramme. By that period, it aims to replace approximately1,016 crore litresof petrol with ethanol. Producing this vast quantity of ethanol would require around165 lakh metric tonnesof food grains. It alsoachievedthe goal of blending 10% ethanol in petrol nationwide in June 2022, five months earlier than the set target. Bihar’s food-to-fuel industry Bihar was the first state in India to introduce an Ethanol Production and Promotionpolicyin 2021, which encouraged new ethanol factories to start operations in Bihar. The policy also aims to increase farmers’ earnings, generate local jobs, and attract investors. Sanjay Kumar Agarwal, secretary of the department of agriculture in Bihar, reveals that the maize production has doubled in the state in the last three years, which further encouraged more ethanol plants. “If you look at Bihar, we are agri-surplus. Rice, wheat and maize are grown in huge quantities. We also have a lot of ground water…Seeing this potential, the government introduced the Ethanol Policy 2021. The response was very good. Bihar has the most ethanol plants at present, in India,” shares Kunal Kishore, Founder and Director, InvestAid India. The Additional Chief Secretary, Department of Industries, Bihar, Sri Sandeep Poundrik confirmed that there are 15 ethanol plants which have started work in Bihar, of which nine have already commenced production, and six plants are under construction. Over 60%of ethanol is produced from sugarcane molasses in India. But with maize being a substantial part of Bihar’s farming produce, the state aims to increase its grain-based ethanol production. Read more:India aims to go big on sugarcane-based ethanol, but water intensity of the crop throws up concerns Maize price goes up with demand The increased demand for maize to produce ethanol, has created fresh opportunities for maize farmers, and the price of maize has  gone up as well. “Currently, the price of maize is between 2,300 and 2,400 rupees per quintal. Three to four years ago, the price was around 1,600 to 1,700 rupees per quintal,” says farmer Dheeraj Kumar from Bisanpur, Purnea. Along with the farmers, the ethanol factories have benefited with the rise in price for maize too. Dilip Patel, the promoter of an ethanol plant Patel Agro Industries Pvt. Ltd. shares, “This (the price rise) has directly benefited the farmers. The Bihar government has offered us (ethanol plants) more subsidies compared to other states. First, the government will provide up to 10% of the bank’s interest as a subsidy. Second, there is also a significant GST exemption. They also provided a lot of incentives for things such as investment in workers. Any industry requires various clearances to be set up, which the Bihar government quickly provided.” However, the rising maize price could also be a cause of concern for Bihar and other states. Ramya Natrajan, a researcher at CSTEP who specialises in alternative fuels notes, “Studies in other countries like the U.S. have shown that this increases the prices of food; there is a lot of inflationary effect of this. We might be seeing that in India. If the demand for ethanol increases, the demand for maize as a food grain, will increase. People will want to cultivate more and more of it, but then it will increase its price.” This story was produced with the support of Internews’ Earth Journalism Network.  Banner image:The central government approved 47 ethanol plants in the state, of which at least 32 are grain-based. Photo by Pranav Kumar.",India Conservation
,0.3,"['Kyasanur Forest Disease', 'KFD', 'Malenadu', 'Karnataka', 'Western Ghats', 'KFD Janajagruthi Okkoota', 'Virus Diagnostic Laboratory (VDL)', 'Shivamogga', 'India Council of Medical Research (ICMR)', 'Mongabay-India', 'Government of Mysore', 'The Rockefeller Foundation']",,"Wildlife, Forests, Governance",1.0,"Malenadu region, Karnataka",Mongabay,Other,2024-04-12 00:00:00+00:00,Arathi Menon,0.0,English,"Kyasanur Forest Disease (KFD), also known as monkey fever, is escalating in Karnataka's Malenadu region, driven by climate change factors and exacerbated by habitat destruction and land use changes. Despite vaccination efforts, cases and fatalities continue, amid warnings of intensified risks due to tick proliferation influenced by weather patterns. The disease's spread highlights the complex interplay between environmental degradation and human health risks.",0.5,Kyasanur Forest Disease: A ticking health bomb in the Western Ghats,https://india.mongabay.com/2024/04/kyasanur-forest-disease-a-ticking-health-bomb-in-the-western-ghats/,,"Species Loss, Terrestrial Habitat, Habitat Loss, Governance, Invasive Species, Climate Change",,Karnataka,"Kyasanur Forest Disease, a tick-borne viral illness, continues to wreak havoc in the Malenadu region of Karnataka, spreading to neighbouring states along the Western Ghats at an alarming rate.Deficient rainfall and intense heat in southern states, conditions conducive to the proliferation of ticks, provide additional risks of the zoonotic disease this year.Deforestation and significant alterations in land use and ecological dynamics have brought the virus and its carriers into closer proximity to human populations.The sudden withdrawal of the KFD vaccine, the only defence against the disease, citing potency issues, has left the residents of hotspots and health workers in a lurch. As temperatures rise in Karnataka’s Malenadu region, located along the Western Ghats, the residents remain on high alert due to the resurgence of a tick-borne illness endemic to India—Kyasanur Forest Disease (KFD). Locally known as monkey fever ormangana kayilein Kannada, this viral haemorrhagic disease, caused by aFlavivirusin the family ofFlaviviridae, carries an estimated fatality rate of3% to 15%. Dengue, in comparison, killsaround 2.6%of the infected, according to an estimate. The zoonotic disease follows a predictable annual cyclic pattern, emerging during the peak winter months of November and December, reaching its zenith in the summer, and then disappearing completely with the onset of monsoon, only to resurface with varying intensity the following year. Since January this year, the region has alreadyrecorded 12 deaths, and more than 250 positive cases of KFD. The recent demise of a seven-year-old child in Uttara Kannada district due to KFD has heightened concerns. Highlighting the gravity of the situation, K.P. Sripal, a Shivamogga-based advocate and a member of the KFD Janajagruthi Okkoota, a civil society group advocating for better accountability and government protection against the disease, notes that this tragic incident marks the first child fatality from the disease in over 30 years. While we couldn’t verify the claim due to a lack of data, Dr K. J. Harshavardhan, deputy director of the government-run Virus Diagnostic Laboratory (VDL) in Shivamogga, says that a child’s death is a rare occurrence in KFD cases. “Young children do not go into the forest often and they also have better immunity against the virus. This death is a rare one,” he tells Mongabay-India. Health officials also observe a broader trend wherein KFD cases peak approximately every four or five years, although no official study has been conducted to substantiate this claim. This trend could potentially be due to the four to five-year immunity the body builds against the virus after an attack, points out Shivamogga resident Darshan Narayan, a scientist with ATREE who has previously worked with the Indian Council of Medical Research (ICMR) and the state health department on the disease. Thus, 2024 holds particular significance, as the local residents and officials report that the last major outbreak in this region occurred in 2019. A looming threat of deficient rainfall and intense heat,conditions conduciveto the proliferation of ticks, provides additional risks this year. “The absence of customary December showers, which typically flush away ticks in their nymph stage—when they are most virulent—has been particularly concerning,” explains Harshavardhan. “While case numbers surged in January and February, there appears to be a promising downward trajectory in March,” he adds. This Mongabay-India correspondent travelled to Kyasanur and Aralagodu villages, Shivamogga town, and surrounding areas to interview residents and officials at KFD’s hotspots.  How Kyasanur found its place in history Kyasanur Forest Disease was first identified in 1957 within the Kyasanur forest range, adjacent to a village of the same name in Soraba taluk of Shivamogga. The sudden death of numerous monkeys, followed by fevers in individuals with a history of forest exposure, prompted the then government (the Government of Mysore) toinitiate emergency measuressuch as free distribution of antibiotics for typhoid. Initially suspected to be typhoid and then yellow fever, subsequent investigations revealed ticks as carriers of an “unknown” virus. Interestingly, despite its name being associated interchangeably with the deadly disease, the village of Kyasanur never reported a death from the disease or has not had any positive KFD cases in the last 25 years, according to the records with VDL, as noted by Darshan. Reflecting on the pivotal days when the disease first emerged, Huchappa, a nonagenarian from Kyasanur village, recounts guiding four forest officers in masks and gloves to the site of the deceased monkeys in the forest. “We spent a fortnight in the forest, returning with the dead monkeys in gunny bags and two live monkeys, caught using sugarcane as bait, in a cage.” He had a ringside view of the historical event unfolding as no other resident was willing to go into the forest with the officers. Huchappa hazily remembers those monkeys asbili mangaor white monkeys, likely referring to Hanuman langurs. Furtherlaboratory analysesconducted on various tick specimens collected from monkeys, bovines, rodents, and humans, by the former Virus Research Centre in Pune, in collaboration with The Rockefeller Foundation, alongside state public health experts, led to the isolation and coding of the virus as P9605. Is land use change responsible for KFD’s spread? During the early stages of detection and research, it was speculated that the virus might have been transmitted via ticks carried by migratory birds. However, the prevailing theory now suggests that thevirus is endemic, and likely circulating within the Malenadu forests from an earlier period. Due to the dense forest cover and minimal human activity within these regions, the virus remained relatively undisturbed. However, with deforestation and significant alterations in land use and ecological dynamics, the virus and its carriers were brought into closer proximity to human populations. Sixteen tick species—most of them belonging to the genusHaemophysalis—out of 40 species of ticks recorded from KFD affected areas, have been found to be carrying the virus. The virus finds its maintenance and amplification within various host animals, each responding differently to infection. Humans, acting as dead-end hosts, typically encounter the virus accidentally and do not contribute to its natural cycle. Small mammals such as porcupines, squirrels, and rodents serve as reservoir hosts, crucial for sustaining the virus’s circulation between ticks and reservoir hosts. Although these animals become infected by the virus, they typically do not display symptoms of illness. In contrast, primates such as Hanuman langurs (Semnopithecus entellus) and bonnet macaques (Macaca radiata), serve as amplifying hosts. The virus undergoes amplification within their bodies, leading to symptomatic infection similar to that seen in humans. The occurrence of monkey deaths serves as a significant indicator, acting as a “sentinel event,” signalling a potential epidemic in the area. From 1957–1971, the disease wasconfined to Shivamoggadistrict. It started spreading to the neighbouring district of Uttara Kannada in 1972 and eight years later, in 1980, cases were reported from Chikkamagaluru and from Dakshina Kannada in 1982. In 2012, the disease was reported from Chamarajanagara district and the Nilgiri district of Tamil Nadu. The following years saw it spread to neighbouring states of Kerala, Goa, and Maharashtra, as well as other districts of Karnataka like Belagavi, Gadag, Mysuru and Hassan. Read more:Deforestation and disease: How natural habitat destruction can fuel zoonotic diseases  ",India Conservation
